FileName;Lines;Words;Chars;TopWords
daily_journal.txt;26;128;796;"and, a, for, prepared, reviewed, consistency, of, naming, short, added"
info.txt;19;149;844;"and, for, ut, in, text, 20260313, files, test, dolor, dolore"
kladivo.txt;19;136;734;"and, the, at, a, two, inventory, for, magna, posuere, porta"
lorem_alpha.txt;22;158;935;"this, and, intentionally, to, dolor, id, testing, paragraph, should, as"
lorem_beta.txt;21;145;792;"et, and, sit, est, it, voluptatem, quia, aut, longer, text"
project_notes.txt;25;134;815;"for, and, files, readable, tests, txt, in, the, file, suitable"
risa.txt;20;145;787;"and, she, the, with, in, old, a, notes, names, at"
technical_overview.txt;24;116;724;"and, file, files, with, strategy, to, sample, repeated, technical, overview"
travel_log.txt;23;119;639;"and, the, day, with, log, from, station, local, recorded, notes"
